{
  "contractVersion": "1.0.0",
  "role": "reviewer",
  "candidateLabel": "candidate-example",
  "cycle": 1,
  "evaluationSequence": null,
  "invocationId": "00000000000000000000000000000000",
  "cliPath": "C:\\Users\\rhenm\\.codex\\plugins\\.plugin-appserver\\codex.exe",
  "cliVersion": "codex-cli 0.145.0-alpha.18",
  "cliSha256": "20d611ef1c9851f4da1cb4609beb6763904f72275cb91517b2400639ca1c28c4",
  "authStatus": "Logged in using ChatGPT",
  "lockPath": "C:\\absolute\\protocol\\experiment\\lock.json",
  "lockSha256": "0000000000000000000000000000000000000000000000000000000000000000",
  "contractSchemaPath": "C:\\absolute\\protocol\\experiment\\schemas\\role-runtime-contract.schema.json",
  "contractSchemaSha256": "0000000000000000000000000000000000000000000000000000000000000000",
  "canonicalPathHelperPath": "C:\\absolute\\protocol\\scripts\\canonicalize-paths.mjs",
  "canonicalPathHelperSha256": "0000000000000000000000000000000000000000000000000000000000000000",
  "runnerPath": "C:\\absolute\\protocol\\scripts\\run-cli-role.ps1",
  "runnerSha256": "0000000000000000000000000000000000000000000000000000000000000000",
  "evidenceSchemaPath": "C:\\absolute\\protocol\\experiment\\schemas\\cli-supervision-evidence.schema.json",
  "evidenceSchemaSha256": "0000000000000000000000000000000000000000000000000000000000000000",
  "promptTemplatePath": "C:\\absolute\\protocol\\experiment\\prompts\\blinded-reviewer.md",
  "promptTemplateSha256": "0000000000000000000000000000000000000000000000000000000000000000",
  "promptSubstitutions": {
    "CANDIDATE_LABEL": "candidate-example",
    "CYCLE_NUMBER": "1",
    "SNAPSHOT_COMMIT": "0000000000000000000000000000000000000000",
    "WALL_CLOCK_DEADLINE_ISO": "2026-07-20T00:15:00Z"
  },
  "artifactSchemaPath": "C:\\absolute\\protocol\\experiment\\schemas\\review.schema.json",
  "artifactSchemaSha256": "0000000000000000000000000000000000000000000000000000000000000000",
  "inputCommit": "0000000000000000000000000000000000000000",
  "inputTree": "0000000000000000000000000000000000000000",
  "promptPath": "C:\\absolute\\role-prompt.md",
  "promptSha256": "0000000000000000000000000000000000000000000000000000000000000000",
  "workdir": "C:\\absolute\\read-only-snapshot",
  "evidenceRoot": "C:\\absolute\\isolated-evidence-root",
  "finalPath": "C:\\absolute\\isolated-evidence-root\\final.json",
  "stdoutPath": "C:\\absolute\\isolated-evidence-root\\stdout.jsonl",
  "stderrPath": "C:\\absolute\\isolated-evidence-root\\stderr.txt",
  "evidencePath": "C:\\absolute\\isolated-evidence-root\\evidence.json",
  "tempRoot": "C:\\absolute\\isolated-role-runtime\\temp",
  "cacheRoot": "C:\\absolute\\isolated-role-runtime\\cache",
  "dependencyRoot": "C:\\absolute\\isolated-role-runtime\\deps",
  "port": 42001,
  "deadlineSeconds": 900,
  "sandboxMode": "read-only",
  "inputDisposition": "read-only-snapshot",
  "packageManifestPath": null,
  "packageManifestSha256": null,
  "packageLabel": null,
  "packageSha256": null,
  "handoffPath": null,
  "handoffSha256": null,
  "rubricPath": null,
  "rubricSha256": null,
  "hiddenSuiteId": null,
  "hiddenSuitePath": null,
  "hiddenSuiteSha256": null,
  "packageManifestSchemaPath": null,
  "packageManifestSchemaSha256": null,
  "packageScriptPath": null,
  "packageScriptSha256": null
}
